name,school,espn_id,photo_url,summary,year,size,weight,speed,fantasyMultiplier
Fernando Mendoza,Indiana,4837248,,"Fernando Mendoza (6’5/225) transferred to Indiana and delivered one of the most dominant quarterback seasons in recent college football history in 2025. He completed 70%+ of his passes for 3,535 yards and a nation-leading 41 passing touchdowns, added 6 rushing scores, and guided the Hoosiers to a perfect 16-0 record capped by a 27-21 CFP national championship win over Miami. Earned the Heisman Trophy (first in program history), Maxwell Award finalist recognition, and All-Big Ten First Team honors. Consensus QB1 on 2026 mock draft boards, Mendoza displays excellent accuracy, pocket poise, pre-snap processing, and leadership traits that position him as a high-floor franchise quarterback prospect with Day 1 starter readiness. Weaknesses include average arm strength that limits deep-ball velocity against tight coverage, and occasional sack-prone tendencies when facing pressure (though improved from prior seasons). Projects as the top overall selection in the 2026 NFL Draft with the tools to start immediately and develop into a long-term NFL starter. ",Junior,6'5,225,4.85,1.6
Caleb Downs,Ohio State,4870706,,"Caleb Downs (6’0/205) didn’t just play safety in 2025—he redefined the position after transferring to Ohio State, turning into a generational, scheme-proof chess piece who wrecked offenses from every angle. Elite range that covers half the field, football IQ that reads plays before they happen, bone-crushing open-field tackling, and ball-hawking instincts that produced multiple INTs/PBUs—earning Thorpe Award finalist status, unanimous All-American honors, All-Big Ten First Team, and consensus top-5 overall buzz as the undisputed DB1 of the class. A true unicorn with immediate Day 1 starter upside in single-high, two-high, box, or nickel roles, capable of flipping games with one play. Weaknesses: Over-aggressive tendencies (sells out for hits, occasional missed tackles in space); size/durability concerns against bigger tight ends and blockers in the run game; not elite top-end recovery speed vs. true burners. Still, the traits scream franchise safety—first defensive back off the board in 2026 with All-Pro ceiling written all over him.",Junior,6'0,205,4.45,0.35
Arvell Reese,Ohio State,4950400,,"Arvell Reese (6’4/243) was a key starter and productive linebacker for Ohio State’s defense in 2025, playing a versatile role that included off-ball duties, edge setting, and occasional blitz packages. He recorded consistent tackle production, multiple TFLs and sacks as a pass-rush threat, and showed strong coverage skills against tight ends and running backs in man/match situations. Earned All-Big Ten recognition and received Butkus Award watch list consideration. A sideline-to-sideline athlete with good range, quickness in space, and instincts that allowed him to diagnose plays quickly and make plays on the ball. Versatile three-down traits with immediate starter upside at the next level. Weaknesses include ongoing development of stack-and-shed strength against climbing blockers and occasional over-pursuit or false steps in run fits when aggressive. Projects as a high-floor, early Day 2 selection (late 1st/early 2nd range) in the 2026 NFL Draft with the athletic profile and production to develop into a long-term starter and potential Pro Bowl contributor in schemes that utilize his range and coverage ability. ",Junior,6'4,243,4.52,0.4
Jeremiyah Love,Notre Dame,4870808,,"Jeremiyah Love (6’0/214) straight-up detonated in 2025 as Notre Dame’s three-down supernova, morphing into the most complete, explosive, and terrifying running back prospect in the entire class. Legit 4.4 speed that turns on a dime, vision that sees lanes before they exist, velvet-soft hands (50+ catches as a receiver), and home-run burst that left secondaries in the dust—racking up 1,200+ all-purpose yards and 12+ TDs while punishing anyone who dared tackle him. A Doak Walker semifinalist with All-Independent honors, this dude is the ultimate zone-scheme cheat code: patient behind the line, decisive when the hole opens, and absolutely electric in space. He lines up in the slot, smokes linebackers on screens, catches swing passes like a WR, and turns short gains into house calls with YAC violence. Versatile modern weapon who can be your RB1, change-of-pace back, or third-down mismatch nightmare—early 2026 first-round whispers are turning into screams. Weaknesses? Pass-pro technique is still maturing (occasional whiffs against speed rushers); ball security lapses under heavy contact (a few fumbles when he’s taking big hits). But those are coachable, fixable, low-floor issues on a sky-high ceiling. The traits scream RB1 from Day 1: elite burst, vision, hands, contact balance, special-teams upside, and the kind of juice that makes defensive coordinators lose sleep. In a loaded 2026 RB class, Love is the one teams will fight over at the top of Round 1. Franchise back. Game-changer. The clear #1 RB off the board. ",Junior,6'0,214,4.4,1.4
Rueben Bain,Miami (FL),4870617,,"Rueben Bain Jr. (6’3/275) was one of the most productive and disruptive edge rushers in college football in 2025 at Miami, recording double-digit sacks, 20+ TFLs, and consistent pressures while earning ACC Defensive Player of the Year, Nagurski Trophy finalist status, and unanimous All-American honors. He combined a powerful, explosive frame with a quick first step, violent hand usage, elite run-defense strength, and a high motor that allowed him to impact both pass and run phases. Versatile alignment options (stand-up EDGE to 5-technique) and game-wrecking ability made him a consistent matchup problem for offensive tackles. Consensus top-5 EDGE prospect on most big boards entering the 2026 NFL Draft process. Weaknesses include limited prototypical arm length and elite ankle flexibility/bend to consistently win around the corner with speed; occasional gap discipline lapses when pursuing stats aggressively. Projects as a high-floor, Day 1 starter with top-10 overall pick potential in schemes that value power and motor over pure bend.",Junior,6'3,275,4.72,0.5
Carnell Tate,Ohio State,4871023,,"Carnell Tate (6’3/195) didn’t just meet expectations in 2025—he became the latest crown jewel in Ohio State’s legendary WR factory, emerging as a polished, five-star separator with elite route-running savvy, vice-like hands, and jaw-dropping body control that made him a nightmare matchup on every level. He racked up 800+ yards and 8+ touchdowns, flashing explosive deep-threat ability, red-zone dominance, and consistent big-play production that earned him All-Big Ten honors and a spot on the Biletnikoff Award watch list. A true WR1 prospect with first-round polish, smooth releases, and the contested-catch reliability scouts drool over, positioning him as a top-15 overall wideout in the loaded 2026 class. Weaknesses: Lacks elite top-end speed and burst to consistently create separation vertically; YAC elusiveness is solid but not game-breaking; can get jammed and disrupted at the line by long, physical press corners. Still, the tape screams high-floor, high-ceiling starter with WR1 traits ready to translate Day 1.",Junior,6'3,195,4.6,1.4
Jordyn Tyson,Arizona State,4880281,,"Jordyn Tyson (6’2/200) transferred from Colorado to Arizona State in 2025 and quickly established himself as one of the most productive and reliable boundary receivers in the Big 12. He finished the season with over 1,000 receiving yards and 10+ touchdowns, demonstrating strong contested-catch ability (top-10 rate in the class), effective yards after catch, and physicality at the catch point that allowed him to win consistently on the perimeter. He earned All-Big 12 honors and was named a Biletnikoff Award semifinalist, showing dependable hands, route nuance, and red-zone effectiveness on back-shoulder and fade throws. A polished separator with good size and reliable production, he projects as a low-risk prospect with WR2/WR1 potential in pro schemes. Areas for development include elite top-end speed to stretch the field vertically and handling physical press coverage from longer corners at the line of scrimmage. Overall, his combination of traits, production, and consistency gives him a solid Day 2 projection (Round 2-3 range) in the 2026 NFL Draft with immediate starter upside at the next level. ",Junior,6'2,200,4.5,1.4
David Bailey,Texas Tech,4685248,,"David Bailey (6’3/250) exploded in 2025 at Texas Tech (post-Stanford transfer), leading FBS with 13.5 sacks, 17.5 TFLs, a 93 PFF pass-rush grade (highest among EDGEs), Unanimous All-American honors, Big 12 Defensive Lineman of the Year, and a #3 ranking on Bruce Feldman’s Freaks List. Elite first-step burst, closing speed, violent hands, and relentless production make him a top-10 overall prospect (potential No. 2-3 non-QB). Explosive pass-rush specialist with three-down flashes and game-wrecking upside. Weaknesses: Poor run defense anchor (timid vs. blockers, high pad level, engulfed often); emotional control issues (past incidents) may drop stock slightly. High-upside disruptor with Day 1 impact potential in 2026. ",Senior,6'3,250,4.52,0.5
Peter Woods,Clemson,4871063,,"Peter Woods (6’3/315) wasn’t just an anchor—he was the immovable force that powered Clemson’s defensive front in 2025, a true interior wrecking ball with brute power, lightning-quick snap explosion, and relentless disruptive presence that racked up multiple sacks, TFLs, and pressures while stonewalling run lanes. Earned All-ACC honors, made the Outland Trophy watch list, and consistently graded as one of the most reliable run-stuffers in the country—clogging gaps with violent hand usage, low pad level, and a high motor that wore down blockers over four quarters. A high-floor, NFL-ready 3-technique/NT hybrid with immediate rotational starter traits and the physicality to clog lanes against power schemes. Weaknesses: Pass-rush production remains limited (few counters or bend to finish rushes); occasional gap-sound lapses when he gambles for stats instead of staying disciplined; not a consistent interior penetrator against double-teams. Still, the tape screams dependable mid-round value in the 2026 draft—perfect Day 2 rotational piece with three-down upside if he refines the rush plan.",Junior,6'3,315,4.75,0.35
Keldric Faulk,Auburn,4870989,,"Keldric Faulk (6’6/285) straight-up owned Auburn’s edge in 2025, terrorizing offenses with 55+ tackles, 10+ TFLs, 7+ sacks, and suffocating run defense that earned him All-SEC honorable mention and vaulted him into top-20 overall prospect status (EDGE3-5 consensus range). A towering, violent-handed monster with a devastating bull rush, gap-clogging power, and a nonstop motor — this guy’s a versatile 5-technique/EDGE hybrid built like a brick wall with NFL starter traits already stamped on him. Three-down wrecking ball potential who can set the edge, collapse pockets, and wear down blockers. Weaknesses: Bend and speed to the corner aren’t elite; pass-rush plan is still raw with limited counters against quicker tackles; can play too high at times. Still, the floor is sky-high — a Day 1 starter with massive upside in the 2026 draft. ",Junior,6'6,285,4.74,0.5
Jermod McCoy,Tennessee,5157289,,"Jermod McCoy (6’0/193) locked down Tennessee’s boundary as the ultimate press-man corner in 2025, delivering a ferocious post-injury bounce-back with elite ball skills (multiple INTs/PBUs), blazing recovery speed, and punishing run support that earned him All-SEC honors, Jim Thorpe Award watch list recognition, and top-50 overall buzz. A shutdown technician with fluid hips, quick feet, route anticipation, and physicality in press coverage—his athletic fluidity and aggressive trigger make him a true CB1 candidate with Day 1 starter upside. Weaknesses: Lingering injury history (torn ACL) raises durability flags; struggles to match taller vertical threats due to limited length; can get grabby when challenged. Still, the traits scream high-ceiling starter in the 2026 draft. ",Junior,6'0,193,4.52,0.25
Mansoor Delane,LSU,4880124,,"Mansoor Delane (6’0/190) didn’t just lock down LSU’s secondary in 2025—he turned it into a no-fly zone after transferring from Virginia Tech, leading the entire SEC with 13 pass breakups, allowing a microscopic 26.7 passer rating when targeted, racking up 45 tackles, and snagging multiple INTs/PBUs that flipped games. A unanimous All-American, First-Team All-SEC selection, Jim Thorpe Award semifinalist, and consensus top-15 overall prospect (CB3-5 range), Delane is an elite press-man technician with lightning-quick feet, razor-sharp route awareness, ball-hawking instincts, and nasty physicality in run support that makes him a complete boundary nightmare. Declared early for 2026, this guy’s a shutdown corner with immediate Day 1 starter upside and the traits to become a CB1 in the NFL. Weaknesses: Size and length limit him against taller vertical threats; recovery burst can lag slightly against true elite burners who get a step. Still, the floor is sky-high—high-floor, high-ceiling CB1 potential with lockdown traits ready to translate from Week 1. ",Senior,6'0,190,4.44,0.25
Makai Lemon,USC,4870795,,"Makai Lemon (5’11/195) emerged as USC’s primary receiving threat in 2025, leading the Trojans with 96 receptions for 1,156 yards (96.3 YPG) and 11 touchdowns while also contributing as a return specialist with multiple scores on punts and kicks. His performance earned the Fred Biletnikoff Award (first Trojan since Marqise Lee in 2012), unanimous All-American honors, and Pac-12 Offensive Player of the Year finalist status. Lemon displayed crisp route-running, reliable hands, quick acceleration after the catch, and versatility across alignments (slot, boundary, motion). He consistently generated separation underneath and intermediate, created yards after contact, and impacted games in multiple phases. Areas for development include limited height and contested-catch ability against longer corners, as well as occasional concentration drops in heavy traffic or at the high point. Overall, his production, polish, and playmaking position him as a high-upside receiver with WR1/WR2 potential in pro schemes and Day 1 starter traits in the 2026 NFL Draft. ",Junior,5'11,195,4.48,1.4
Sonny Styles,Ohio State,5081807,,"Sonny Styles (6’4/243) served as a three-year starter for Ohio State in 2025, transitioning from safety to linebacker and anchoring one of the nation’s top defenses. He recorded 77 tackles, 7 TFLs, 1 sack, 1 interception, 1 forced fumble, and displayed near-elite tackling efficiency (only 1 miss all season). Earned All-Big Ten honors and ranked as a top-10 overall prospect on several big boards (LB2 behind Arvell Reese in some rankings). Showed excellent 4.48 speed, smooth transitional movement, strong coverage skills (low yards per catch allowed), and sideline-to-sideline range in both run and pass phases. Versatile three-down linebacker capable of playing Mike, Will, or dime roles, with leadership traits and immediate starter upside at the next level. Weaknesses include inconsistent physicality and shedding vs. climbing blockers, occasional slow reads or false steps in run fits when aggressive, and ongoing need for added functional strength and mass to anchor against power run games. Projects as a high-floor, early Day 2 selection (late 1st/early 2nd range) in the 2026 NFL Draft with the athletic profile and production to develop into a long-term starter and potential Pro Bowl contributor.",Senior,6'4,243,4.48,0.4
Kenyon Sadiq,Oregon,5083315,,"Kenyon Sadiq (6’3/245) was Oregon’s leading pass-catcher in 2025, finishing with 51 receptions for 560 yards and 8 touchdowns while earning Big Ten Tight End of the Year, Mackey Award finalist status, and First-Team All-Big Ten honors. He was widely regarded as the TE1 in the 2026 class with top-10 overall prospect consideration on several boards. Sadiq displayed strong vertical seam ability, good leaping at the catch point, precise route-running, and versatility across alignments (in-line, slot, motion), forcing defensive coordinators to adjust coverage schemes weekly. He contributed on over 50% of snaps as a blocker, adding legitimate every-down value. Declared early for the 2026 NFL Draft following a breakout junior season. Weaknesses include inconsistent blocking technique (needs added mass and improved hand placement) and a 245-pound frame that can be overpowered by NFL-caliber power edges in the run game until further development. Overall, his receiving polish, athletic traits, and production position him as a high-upside TE with Day 1 starter potential and TE1/TE2 ceiling in pro schemes. ",Junior,6'3,245,4.55,1.2
Avieon Terrell,Clemson,4870988,,"Avieon Terrell (5’11/180) didn’t just emerge in 2025—he became Clemson’s shutdown lockdown artist at boundary and nickel, rewriting the record books with a monster season: 48 tackles, 4.5 TFLs, 3 sacks, 9 PBUs, and an eye-popping 5 forced fumbles (new Clemson DB single-season record). A unanimous All-American, First-Team All-ACC standout, and Jim Thorpe Award semifinalist, the younger brother of Falcons CB A.J. Terrell flashed elite 4.39 speed, fluid hips that mirror routes, ball-hawking instincts that turn targets into turnovers, and a nose for the football that made him a turnover machine. A top-30 overall prospect (CB5-7 consensus range), he’s a versatile utility corner with Day 1 starter upside in press-man, zone, or slot schemes—high-floor, scheme-flexible talent ready to contribute immediately. Weaknesses: Undersized frame gets challenged in contested-catch situations against bigger-bodied receivers; run support downhill attack lacks consistent urgency and physicality. Still, the traits scream first-round potential in the 2026 draft—a shutdown playmaker with CB1 upside if he adds strength and polish. ",Junior,5'11,180,4.39,0.25
Ty Simpson,Alabama,4685522,,"Ty Simpson (6’3/215) took over as Alabama’s starting quarterback in 2025 and delivered one of the most efficient and productive seasons in program history. He completed 68%+ of his passes for over 3,800 yards and 38 touchdowns, while adding 400+ rushing yards and 6 rushing scores. Earned All-SEC First Team honors and SEC Offensive Player of the Year finalist recognition, demonstrating strong arm strength, deep-ball accuracy, pocket poise, mobility to extend plays, and the ability to make reads under pressure. A dual-threat quarterback capable of attacking all levels of the field and leading the offense effectively. Weaknesses include occasional happy feet and hold-the-ball tendencies when facing pressure, aggressive decision-making in tight windows against elite coverage, and pre-snap processing that can lag under duress. Projects as a mid-to-late Day 2 selection (Round 2-4 range) in the 2026 NFL Draft with starter potential in schemes that utilize his arm talent and mobility, provided he refines decision-making and pocket mechanics. ",Junior,6'2,208,4.8,1.6
Denzel Boston,Washington,4832800,,"Denzel Boston (6’4/209) solidified his status as Washington’s go-to boundary X-receiver in 2025, delivering a breakout junior campaign with 62 receptions for 881 yards (14.2 avg) and 11 touchdowns—leading the Huskies in all major receiving categories despite team struggles and earning third-team All-Big Ten honors (coaches/media) plus honorable mention as a return specialist. A big-bodied, physical mismatch nightmare with elite hand strength, contested-catch prowess, and outstanding body control, he torched secondaries on jump balls, back-shoulder fades, and red-zone fades while adding explosive YAC and return ability (including a 78-yard punt return TD). Third-team All-Big Ten WR and a rising top-50 overall prospect in the 2026 class, Boston projects as a high-floor, Day 2 starter with WR2 upside in pro schemes thanks to his size-speed combo and reliable hands. Weaknesses: Not elite top-end speed or separation quickness against press coverage; occasional concentration drops in traffic; limited after-catch elusiveness vs. elite tacklers. Still, the physical tools, production, and upside scream first-round value with WR1 traits if he refines the release package and adds polish. ",Junior,6'4,209,4.52,1.4
Kayden McDonald,Ohio State,4870893,,"Kayden McDonald (6'3/326) wasn't just a rotational piece in 2025—he became the immovable cornerstone of Ohio State's elite defensive line, evolving into a full-time starting nose tackle who absolutely erased interior gaps with freakish brute power, explosive first-step quickness off the snap, and a relentless high motor that wore down entire offensive lines. He piled up 47 tackles, 8 TFLs, 3 sacks, and 2 forced fumbles, earning All-Big Ten honorable mention and generating top-20 overall prospect buzz (DL2-4 range) as one of the most dominant run-stuffers in the country. A massive, low-leverage frame that clogs lanes, swallows double-teams, and disrupts backfields with violent hand placement and sheer strength—this guy's a three-down interior force with the physical tools and motor to anchor any NFL front from Day 1. Weaknesses: Pass-rush arsenal remains limited (few counters or bend to finish rushes); can get a tick slow off the snap in obvious passing situations when he's not in attack mode. Still, the floor is rock-solid and the ceiling is sky-high—a dominant nose tackle difference-maker with immediate starter impact and All-Pro potential in the 2026 draft.",Junior,6'3,326,5.15,0.35
C.J. Allen,Georgia,4870598,,"CJ Allen (6’3/235) didn’t just play linebacker for Georgia in 2025—he became the explosive, sideline-to-sideline missile that defensive coordinators built entire game plans around, emerging as one of the most dynamic and versatile off-ball ’backers in the country. A former five-star recruit who lived up to the hype, Allen flashed elite range, sudden burst off the edge (multiple sacks/TFLs as a blitzer), lockdown coverage skills in man/match against TEs/RBs, and bone-crushing open-field tackling that left ball carriers seeing stars. He earned All-SEC honorable mention, Butkus Award watch list buzz, and top-30 overall prospect ranking (LB5-8 range) thanks to his athleticism, instincts, and ability to impact every phase—run fits, blitz packages, zone drops, and even nickel sub-packages. A true three-down weapon with sideline-to-sideline pursuit speed, pre-snap diagnostic quickness, and the physical tools to develop into a Pro Bowl linebacker in the NFL. Weaknesses: Still building stack/shed strength and functional power against climbing blockers; occasional over-pursuit and false steps when he gets too aggressive in run fit; needs added mass to consistently anchor vs. power run games. Still, the tape screams high-ceiling impact player in the 2026 draft—Day 2 starter upside (late 1st/early 2nd projection) as a plug-and-play Will/Mike ’backer ready to disrupt from Week 1 with All-Pro traits if he refines the run game details. ",Junior,6'2,235,4.55,0.4
Kevin Concepcion,Texas A&M,4870653,,"Kevin Concepcion (5'11/190) didn't just redefine versatility in 2025—he turned himself into the most dangerous offensive chess piece in college football at Texas A&M, exploding for 61 receptions, 919 yards, and 9 touchdowns while claiming the Paul Hornung Award as the nation's premier all-purpose threat. An electric slot nightmare with intermediate route savvy, sudden burst to create separation underneath, and game-breaking YAC acceleration that shredded pursuit angles and turned short passes into chunk plays. Add elite return ability (multiple return TDs on punts/kicks), chain-moving reliability, and the ability to line up anywhere from the slot to motion alignments, and you have a high-floor, scheme-flexible weapon with legitimate first-round pedigree and WR2 upside in modern NFL offenses. While ball security under pressure and physicality against press coverage remain developmental focal points, the production, explosiveness, and playmaking scream immediate Day 1 impact. Concepcion enters the 2026 Draft as one of the nation's purest offensive dynamos—ready to tilt games from the jump.",Junior,5'11,190,4.46,1.4
Cashius Howell,Texas A&M,4710752,,"Cashius Howell (6’2/248) didn’t just play edge for Texas A&M in 2025—he became the most dominant, disruptive force on one of the SEC’s best defensive lines, turning into a game-wrecking nightmare after transferring from Bowling Green. In his lone season with the Aggies, Howell exploded with elite burst off the snap, violent hand usage, inside counters (that spin move was filthy), and relentless motor that racked up double-digit sacks, TFLs, pressures, and run-defense stops—earning unanimous All-American honors, SEC Defensive Player of the Year, and consensus top-15 overall prospect status (often EDGE1 or EDGE2 in the class). A bendy, explosive rusher with the length to stack/shed, quickness to win inside, and the power to bull through tackles, he collapsed pockets, erased running lanes, and flipped games with one-play impact—projected as a top-15 pick in the 2026 NFL Draft (Daniel Jeremiah had him at No. 15 to Tampa Bay in his first mock). Versatile enough to rush from wide-9, 5-technique, or even slide inside on sub-packages, Howell’s traits scream Day 1 starter with All-Pro ceiling. Weaknesses: Occasional high pad level vs. stronger interior blockers; pass-rush plan can be power-heavy without elite bend against quicker tackles; needs added mass for anchor strength in heavy run fronts. But the tape is undeniable—this is a franchise-altering edge rusher ready to dominate NFL offenses from Week 1 in 2026. ",Senior,6'4,248,4.65,0.5
